id,name,price,description,url,imageurl
25696529M,Tweed Short Sleeve Jacket.,189.0,You will love to pair this jacket with great Commerce Cloud Store pant or skirt! Wear 9 to 5 and beyond! You will love to pair this jacket with great Commerce Cloud Store pant or skirt! Wear 9 to 5 and beyond!,https://zzsu-060.dx.commercecloud.salesforce.com/s/RefArch/tweed-short-sleeve-jacket/25696529M.html?lang=en_US,https://zzsu-060.dx.commercecloud.salesforce.com/on/demandware.static/-/Sites-apparel-m-catalog/default/dwd8be8401/images/large/PG.10240847.JJE84XX.PZ.jpg
25696540M,Jewel Neck Jacket.,179.0,A jewel neck jacket is just what the busy professional woman needs. You don't have to sacrifice great fit and quality for comfort! A jewel neck jacket is just what the busy professional woman needs. You don't have to sacrifice great fit and quality for comfort!,https://zzsu-060.dx.commercecloud.salesforce.com/s/RefArch/jewel-neck-jacket/25696540M.html?lang=en_US,https://zzsu-060.dx.commercecloud.salesforce.com/on/demandware.static/-/Sites-apparel-m-catalog/default/dw0ae35568/images/large/PG.10244637.JJEA2XX.PZ.jpg
25696559M,Classic 2 Button Pant.,114.0,A classic 2 button pant is just what the busy professional woman needs. You don't have to sacrifice great fit and quality for comfort! A classic 2 button pant is just what the busy professional woman needs. You don't have to sacrifice great fit and quality for comfort!,https://zzsu-060.dx.commercecloud.salesforce.com/s/RefArch/classic-2-button-pant/25696559M.html?lang=en_US,https://zzsu-060.dx.commercecloud.salesforce.com/on/demandware.static/-/Sites-apparel-m-catalog/default/dwaf304753/images/large/PG.10244665.JJEA2XX.PZ.jpg
25696598M,Long Printed Skirt.,149.0,You will love how easy this skirt is to wear! Wear it on your next night on the town! You will love how easy this skirt is to wear! Wear it on your next night on the town!,https://zzsu-060.dx.commercecloud.salesforce.com/s/RefArch/long-printed-skirt/25696598M.html?lang=en_US,https://zzsu-060.dx.commercecloud.salesforce.com/on/demandware.static/-/Sites-apparel-m-catalog/default/dw89f2e6e5/images/large/PG.10244685.JJE53XX.PZ.jpg
25696606M,Pencil Skirt.,89.0,Pencil skirts are always in style especially if paired with a great suit jacket and classic cami. Pencil skirts are always in style especially if paired with a great suit jacket and classic cami.,https://zzsu-060.dx.commercecloud.salesforce.com/s/RefArch/pencil-skirt/25696606M.html?lang=en_US,https://zzsu-060.dx.commercecloud.salesforce.com/on/demandware.static/-/Sites-apparel-m-catalog/default/dw4ba46aec/images/large/PG.10244697.JJEA2XX.PZ.jpg
25696614M,Short Sleeve Printed Blouse.,99.0,We took this classic silhouette and updated this blouse with a new print for an elegant look. We took this classic silhouette and updated this blouse with a new print for an elegant look.,https://zzsu-060.dx.commercecloud.salesforce.com/s/RefArch/short-sleeve-printed-blouse/25696614M.html?lang=en_US,https://zzsu-060.dx.commercecloud.salesforce.com/on/demandware.static/-/Sites-apparel-m-catalog/default/dw7f808cf9/images/large/PG.10244701.JJE53XX.PZ.jpg
25696622M,Tweed Pencil Skirt.,109.0,A tweed pencil skirt is just what the busy professional woman needs. You don't have to sacrifice great fit and quality for comfort! A tweed pencil skirt is just what the busy professional woman needs. You don't have to sacrifice great fit and quality for comfort!,https://zzsu-060.dx.commercecloud.salesforce.com/s/RefArch/tweed-pencil-skirt/25696622M.html?lang=en_US,https://zzsu-060.dx.commercecloud.salesforce.com/on/demandware.static/-/Sites-apparel-m-catalog/default/dw3d56d781/images/large/PG.10244717.JJE84XX.PZ.jpg
25696630M,Mixed Media Dress.,159.0,This dress is truly amazing! We love this dress and so will you! Be the talk of your next get together! This dress is truly amazing! We love this dress and so will you! Be the talk of your next get together!,https://zzsu-060.dx.commercecloud.salesforce.com/s/RefArch/mixed-media-dress/25696630M.html?lang=en_US,https://zzsu-060.dx.commercecloud.salesforce.com/on/demandware.static/-/Sites-apparel-m-catalog/default/dw326fc006/images/large/PG.10244749.JJE53XX.PZ.jpg
25696638M,Cap Sleeve Wrap Dress.,149.0,Spice up your dress collection with the wrap dress that can take you from day to night. This wrap dress is perfect for any event. Spice up your dress collection with the wrap dress that can take you from day to night. This wrap dress is perfect for any event.,https://zzsu-060.dx.commercecloud.salesforce.com/s/RefArch/cap-sleeve-wrap-dress/25696638M.html?lang=en_US,https://zzsu-060.dx.commercecloud.salesforce.com/on/demandware.static/-/Sites-apparel-m-catalog/default/dwdc03e1c8/images/large/PG.10244893.JJ493XX.PZ.jpg
25696653M,Two Button Notch Collar Jacket.,179.0,A classic long sleeve jacket looks new again. Add the matching pant for a perfect look from nine-to-five and beyond. A classic long sleeve jacket looks new again. Add the matching pant for a perfect look from nine-to-five and beyond.,https://zzsu-060.dx.commercecloud.salesforce.com/s/RefArch/two-button-notch-collar-jacket/25696653M.html?lang=en_US,https://zzsu-060.dx.commercecloud.salesforce.com/on/demandware.static/-/Sites-apparel-m-catalog/default/dwc8aca29e/images/large/PG.10245151.JJ2DGXX.PZ.jpg
25696661M,Slim Pant.,99.0,Classic pant for this weather! Add the Zebra Print Tank for a great look. Pick up a jacket for when the sun goes down! Classic pant for this weather! Add the Zebra Print Tank for a great look. Pick up a jacket for when the sun goes down!,https://zzsu-060.dx.commercecloud.salesforce.com/s/RefArch/slim-pant/25696661M.html?lang=en_US,https://zzsu-060.dx.commercecloud.salesforce.com/on/demandware.static/-/Sites-apparel-m-catalog/default/dwc74f671f/images/large/PG.10245165.JJ2DGXX.PZ.jpg
25696669M,Flat Front Open Jacket.,209.0,You can never go wrong with a classic suit jacket. Add a classic scoop neck shell and pump. You can never go wrong with a classic suit jacket. Add a classic scoop neck shell and pump.,https://zzsu-060.dx.commercecloud.salesforce.com/s/RefArch/flat-front-open-jacket/25696669M.html?lang=en_US,https://zzsu-060.dx.commercecloud.salesforce.com/on/demandware.static/-/Sites-apparel-m-catalog/default/dwa9ad37ed/images/large/PG.10245185.JJ3WWXX.PZ.jpg
25696677M,Ruffle Neckline Button Down Blouse,89.0,Spice up your spring blouse collection with the ruffle neckline blouse.,https://zzsu-060.dx.commercecloud.salesforce.com/s/RefArch/ruffle-neckline-button-down-blouse/25696677M.html?lang=en_US,https://zzsu-060.dx.commercecloud.salesforce.com/on/demandware.static/-/Sites-apparel-m-catalog/default/dw9dfdb2c3/images/large/PG.10245209.JJE84XX.PZ.jpg
25696685M,Wide Leg Pant.,119.0,Wide leg pants are a great way to update your wardrobe; they elongate the leg and can be worn in many ways. You will look stunning when you pair this pant with a Commerce Cloud Store jacket and scoop neck top. Wide leg pants are a great way to update your wardrobe; they elongate the leg and can be worn in many ways. You will look stunning when you pair this pant with a Commerce Cloud Store jacket and scoop neck top.,https://zzsu-060.dx.commercecloud.salesforce.com/s/RefArch/wide-leg-pant/25696685M.html?lang=en_US,https://zzsu-060.dx.commercecloud.salesforce.com/on/demandware.static/-/Sites-apparel-m-catalog/default/dw33428776/images/large/PG.10245233.JJ3WDXX.PZ.jpg
25696693M,Pleated Skirt With Embroidery.,149.0,You will love this pleated skirt! It goes with everything! You will love this pleated skirt! It goes with everything!,https://zzsu-060.dx.commercecloud.salesforce.com/s/RefArch/pleated-skirt-with-embroidery/25696693M.html?lang=en_US,https://zzsu-060.dx.commercecloud.salesforce.com/on/demandware.static/-/Sites-apparel-m-catalog/default/dw22c4b34a/images/large/PG.10245262.JJ3WCXX.PZ.jpg
25696701M,Pleated Flare Skirt.,149.0,You will love this pleated flare skirt! It goes with everything! You will love this pleated flare skirt! It goes with everything!,https://zzsu-060.dx.commercecloud.salesforce.com/s/RefArch/pleated-flare-skirt/25696701M.html?lang=en_US,https://zzsu-060.dx.commercecloud.salesforce.com/on/demandware.static/-/Sites-apparel-m-catalog/default/dwb0613ea3/images/large/PG.10245266.JJ3WWXX.PZ.jpg
25696709M,Sleeveless Pleated Top.,74.0,Perfect alone or paired with a Commerce Cloud Store jacket. Perfect alone or paired with a Commerce Cloud Store jacket.,https://zzsu-060.dx.commercecloud.salesforce.com/s/RefArch/sleeveless-pleated-top/25696709M.html?lang=en_US,https://zzsu-060.dx.commercecloud.salesforce.com/on/demandware.static/-/Sites-apparel-m-catalog/default/dw6efc10a2/images/large/PG.10246278.JJ2DIXX.PZ.jpg
25696717M,Floral Black and White Dress.,139.0,We love this dress and so will you! This dress has a great fit and slits in the back to expose just a hint of back. We love this dress and so will you! This dress has a great fit and slits in the back to expose just a hint of back.,https://zzsu-060.dx.commercecloud.salesforce.com/s/RefArch/floral-black-and-white-dress/25696717M.html?lang=en_US,https://zzsu-060.dx.commercecloud.salesforce.com/on/demandware.static/-/Sites-apparel-m-catalog/default/dwd9970dac/images/large/PG.10246334.JJ2DIXX.PZ.jpg
25696816M,Crew Neck Jacket.,229.0,Dress up any outfit with this crew neck jacket. Perfect for any occasion. Dress up any outfit with this crew neck jacket. Perfect for any occasion.,https://zzsu-060.dx.commercecloud.salesforce.com/s/RefArch/crew-neck-jacket/25696816M.html?lang=en_US,https://zzsu-060.dx.commercecloud.salesforce.com/on/demandware.static/-/Sites-apparel-m-catalog/default/dw7656bf9c/images/large/PG.10247778.JJ3WCXX.PZ.jpg
25696848M,V Neck Jacket.,199.0,Dress up any outfit with this v- neck jacket. Perfect for any occasion. Dress up any outfit with this v- neck jacket. Perfect for any occasion.,https://zzsu-060.dx.commercecloud.salesforce.com/s/RefArch/v-neck-jacket/25696848M.html?lang=en_US,https://zzsu-060.dx.commercecloud.salesforce.com/on/demandware.static/-/Sites-apparel-m-catalog/default/dwb5b8c84b/images/large/PG.10247866.JJ493XX.PZ.jpg
25696873M,Pencil Skirt.,129.0,Pencil skirts are always in style especially if paired with a great suit jacket and classic cami. Pencil skirts are always in style especially if paired with a great suit jacket and classic cami.,https://zzsu-060.dx.commercecloud.salesforce.com/s/RefArch/pencil-skirt/25696873M.html?lang=en_US,https://zzsu-060.dx.commercecloud.salesforce.com/on/demandware.static/-/Sites-apparel-m-catalog/default/dwf3df949f/images/large/PG.10247878.JJ3WCXX.PZ.jpg
25696881M,Floral Print Pencil Skirt.,129.0,We updated our favorite pencil skirt with a floral print. Pencil skirts are always in style especially in a floral print. We updated our favorite pencil skirt with a floral print. Pencil skirts are always in style especially in a floral print.,https://zzsu-060.dx.commercecloud.salesforce.com/s/RefArch/floral-print-pencil-skirt/25696881M.html?lang=en_US,https://zzsu-060.dx.commercecloud.salesforce.com/on/demandware.static/-/Sites-apparel-m-catalog/default/dw88f46c8b/images/large/PG.10247882.JJ5ABXX.PZ.jpg
25696889M,Floral Print Shirt Jacket.,129.0,Pair this with a great Commerce Cloud Store bottom and Commerce Cloud Store jewelry for a perfect look! Pair this with a great Commerce Cloud Store bottom and Commerce Cloud Store jewelry for a perfect look!,https://zzsu-060.dx.commercecloud.salesforce.com/s/RefArch/floral-print-shirt-jacket/25696889M.html?lang=en_US,https://zzsu-060.dx.commercecloud.salesforce.com/on/demandware.static/-/Sites-apparel-m-catalog/default/dw9088f9b2/images/large/PG.10247886.JJ5ABXX.PZ.jpg
25696994M,Sleeveless Blouse.,59.0,"If you're a fan of our classic easy care fitted shirts, then you'll love the new sleeveless option! This is the same great quality and ease of care with a new look! If you're a fan of our classic easy care fitted shirts, then you'll love the new sleeveless option! This is the same great quality and ease of care with a new look!",https://zzsu-060.dx.commercecloud.salesforce.com/s/RefArch/sleeveless-blouse/25696994M.html?lang=en_US,https://zzsu-060.dx.commercecloud.salesforce.com/on/demandware.static/-/Sites-apparel-m-catalog/default/dwefdf28de/images/large/PG.10248610.JJE86XX.PZ.jpg
25697087M,No-Iron Easy Care Sleeveless Shirt,65.0,"You'll love this updated easy care shirt in a roomy and breathable sleeveless body! You can layer it under suits and jackets for a formal and fitted look, or shed those layers for a more casual statement. You'll love this updated easy care shirt in a roomy and breathable sleeveless body! You can layer it under suits and jackets for a formal and fitted look, or shed those layers for a more casual statement.",https://zzsu-060.dx.commercecloud.salesforce.com/s/RefArch/no-iron-easy-care-sleeveless-shirt/25697087M.html?lang=en_US,https://zzsu-060.dx.commercecloud.salesforce.com/on/demandware.static/-/Sites-apparel-m-catalog/default/dwf78479bb/images/large/PG.10250511.JJ2DHXX.PZ.jpg
25697095M,Scoop Neck Knit.,79.0,The knit will add a burst of color to any summer outfit! The knit will add a burst of color to any summer outfit!,https://zzsu-060.dx.commercecloud.salesforce.com/s/RefArch/scoop-neck-knit/25697095M.html?lang=en_US,https://zzsu-060.dx.commercecloud.salesforce.com/on/demandware.static/-/Sites-apparel-m-catalog/default/dwf290fb19/images/large/PG.10251231.JJFX0XX.PZ.jpg
25697133M,Cowl Neck Top,89.0,This basic top is a fashion do! This looks great with any Commerce Cloud Store bottom.,https://zzsu-060.dx.commercecloud.salesforce.com/s/RefArch/cowl-neck-top/25697133M.html?lang=en_US,https://zzsu-060.dx.commercecloud.salesforce.com/on/demandware.static/-/Sites-apparel-m-catalog/default/dw1eacebec/images/large/PG.10251251.JJ2DGXX.PZ.jpg
25697151M,Beaded Cardigan,119.0,Add instant glam to any summer outfit! Perfect for nine to five and beyond! Add instant glam to any summer outfit! Perfect for nine to five and beyond!,https://zzsu-060.dx.commercecloud.salesforce.com/s/RefArch/beaded-cardigan/25697151M.html?lang=en_US,https://zzsu-060.dx.commercecloud.salesforce.com/on/demandware.static/-/Sites-apparel-m-catalog/default/dw9ac343cb/images/large/PG.10251315.JJ3WDXX.PZ.jpg
25697156M,Beaded Shell.,79.0,Wear alone or add the beaded cardigan for a perfect look! Wear alone or add the beaded cardigan for a perfect look!,https://zzsu-060.dx.commercecloud.salesforce.com/s/RefArch/beaded-shell/25697156M.html?lang=en_US,https://zzsu-060.dx.commercecloud.salesforce.com/on/demandware.static/-/Sites-apparel-m-catalog/default/dw9edc747f/images/large/PG.10251327.JJ3WDXX.PZ.jpg
25697161M,Sleeveless Cowl Neck Knit.,79.0,"Take it easy in our short sleeve cowl neck shirt, great for weekend wear. Take it easy in our short sleeve cowl neck shirt, great for weekend wear.",https://zzsu-060.dx.commercecloud.salesforce.com/s/RefArch/sleeveless-cowl-neck-knit/25697161M.html?lang=en_US,https://zzsu-060.dx.commercecloud.salesforce.com/on/demandware.static/-/Sites-apparel-m-catalog/default/dw612011ca/images/large/PG.10251335.JJZ01XX.PZ.jpg
25697176M,No-Iron Easy Care Double Strip Sleeveless Blouse,65.0,"You'll love this updated easy care shirt in a roomy and breathable sleeveless body! You can layer it under suits and jackets for a formal and fitted look, or shed those layers for a more casual statement. You'll love this updated easy care shirt in a roomy and breathable sleeveless body! You can layer it under suits and jackets for a formal and fitted look, or shed those layers for a more casual statement.",https://zzsu-060.dx.commercecloud.salesforce.com/s/RefArch/no-iron-easy-care-double-strip-sleeveless-blouse/25697176M.html?lang=en_US,https://zzsu-060.dx.commercecloud.salesforce.com/on/demandware.static/-/Sites-apparel-m-catalog/default/dw7962f535/images/large/PG.10251353.JJ2DHXX.PZ.jpg
25697184M,Sequined Animal Print Shell.,99.0,The best of both worlds; Animal print and sequined! The best of both worlds; Animal print and sequined!,https://zzsu-060.dx.commercecloud.salesforce.com/s/RefArch/sequined-animal-print-shell/25697184M.html?lang=en_US,https://zzsu-060.dx.commercecloud.salesforce.com/on/demandware.static/-/Sites-apparel-m-catalog/default/dwebc4601e/images/large/PG.10251513.JJ3WWXX.PZ.jpg
25697194M,Ribbed Cardigan.,99.0,A perfect outfit solution is the Commerce Cloud Store cardigan! A perfect outfit solution is the Commerce Cloud Store cardigan!,https://zzsu-060.dx.commercecloud.salesforce.com/s/RefArch/ribbed-cardigan/25697194M.html?lang=en_US,https://zzsu-060.dx.commercecloud.salesforce.com/on/demandware.static/-/Sites-apparel-m-catalog/default/dwe81dd437/images/large/PG.10251573.JJ5AAXX.PZ.jpg
25697203M,Scoop Neck Shell.,69.0,We updated our favorite shells with new colors for the season. Pair with a matching Commerce Cloud Store cardigan for a perfect look! We updated our favorite shells with new colors for the season. Pair with a matching Commerce Cloud Store cardigan for a perfect look!,https://zzsu-060.dx.commercecloud.salesforce.com/s/RefArch/scoop-neck-shell/25697203M.html?lang=en_US,https://zzsu-060.dx.commercecloud.salesforce.com/on/demandware.static/-/Sites-apparel-m-catalog/default/dw5d213659/images/large/PG.10251585.JJ5AAXX.PZ.jpg
25697212M,Drape Neck Dress.,119.0,Look your best in this drape neck dress. Sure to turn heads! Look your best in this drape neck dress. Sure to turn heads!,https://zzsu-060.dx.commercecloud.salesforce.com/s/RefArch/drape-neck-dress/25697212M.html?lang=en_US,https://zzsu-060.dx.commercecloud.salesforce.com/on/demandware.static/-/Sites-apparel-m-catalog/default/dw837cea36/images/large/PG.10251589.JJ3WDXX.PZ.jpg
25697241M,Pleated Flare Skirt.,129.0,You will love this pleated flare skirt! It goes with everything! You will love this pleated flare skirt! It goes with everything!,https://zzsu-060.dx.commercecloud.salesforce.com/s/RefArch/pleated-flare-skirt/25697241M.html?lang=en_US,https://zzsu-060.dx.commercecloud.salesforce.com/on/demandware.static/-/Sites-apparel-m-catalog/default/dw404021bf/images/large/PG.10252193.JJE84XX.PZ.jpg
25697266M,Sleeveless Twist Front Knit Top.,64.0,This sleeveless twist front knit top will become this seasons go -to piece. This looks great with any bottom! This sleeveless twist front knit top will become this seasons go -to piece. This looks great with any bottom!,https://zzsu-060.dx.commercecloud.salesforce.com/s/RefArch/sleeveless-twist-front-knit-top/25697266M.html?lang=en_US,https://zzsu-060.dx.commercecloud.salesforce.com/on/demandware.static/-/Sites-apparel-m-catalog/default/dw49676323/images/large/PG.10254449.JJ493XX.PZ.jpg
25697279M,Belted Short Sleeve Knit Top.,74.0,Ivory looks great with black pants! Dress up with Commerce Cloud Store jewelry. Ivory looks great with black pants! Dress up with Commerce Cloud Store jewelry.,https://zzsu-060.dx.commercecloud.salesforce.com/s/RefArch/belted-short-sleeve-knit-top/25697279M.html?lang=en_US,https://zzsu-060.dx.commercecloud.salesforce.com/on/demandware.static/-/Sites-apparel-m-catalog/default/dwd024cccd/images/large/PG.10254453.JJ5AAXX.PZ.jpg
25697294M,Sleeveless Cowl Neck Knit.,74.0,"Take it easy in our short sleeve cowl neck shirt, great for weekend wear. Take it easy in our short sleeve cowl neck shirt, great for weekend wear.",https://zzsu-060.dx.commercecloud.salesforce.com/s/RefArch/sleeveless-cowl-neck-knit/25697294M.html?lang=en_US,https://zzsu-060.dx.commercecloud.salesforce.com/on/demandware.static/-/Sites-apparel-m-catalog/default/dw1154f4fc/images/large/PG.10254489.JJ3WCXX.PZ.jpg
25697368M,3/4 Sleeve Notch Cardigan.,119.0,A cardigan is this season's must have for chilly nights! A cardigan is this season's must have for chilly nights!,https://zzsu-060.dx.commercecloud.salesforce.com/s/RefArch/3/4-sleeve-notch-cardigan/25697368M.html?lang=en_US,https://zzsu-060.dx.commercecloud.salesforce.com/on/demandware.static/-/Sites-apparel-m-catalog/default/dw2ee5a594/images/large/PG.10255510.JJ3WCXX.PZ.jpg
25697373M,Sleeveless Shell.,79.0,You will love this sleeveless shell alone or with it's matching cardigan. You will love this sleeveless shell alone or with it's matching cardigan.,https://zzsu-060.dx.commercecloud.salesforce.com/s/RefArch/sleeveless-shell/25697373M.html?lang=en_US,https://zzsu-060.dx.commercecloud.salesforce.com/on/demandware.static/-/Sites-apparel-m-catalog/default/dw02eab9a1/images/large/PG.10255578.JJ3WDXX.PZ.jpg
25697378M,Sleeveless Scoop Neck Shell.,59.0,You will love this sleeveless shell alone or with it's matching cardigan. You will love this sleeveless shell alone or with it's matching cardigan.,https://zzsu-060.dx.commercecloud.salesforce.com/s/RefArch/sleeveless-scoop-neck-shell/25697378M.html?lang=en_US,https://zzsu-060.dx.commercecloud.salesforce.com/on/demandware.static/-/Sites-apparel-m-catalog/default/dw2e3a4f68/images/large/PG.10255866.JJ3WCXX.PZ.jpg
25697387M,Boat Neck Sleeveless Sheath Dress.,119.0,"This sleeveless sheath dress is a classic piece for your suiting collection year round. Matched with any suit jacket, solid or patterned, you look professional and sharp. Create a feminine and soft look sporting this piece on its own or with a colorful wrap. This sleeveless sheath dress is a classic piece for your suiting collection year round. Matched with any suit jacket, solid or patterned, you look professional and sharp. Create a feminine and soft look sporting this piece on its own or with a colorful wrap.",https://zzsu-060.dx.commercecloud.salesforce.com/s/RefArch/boat-neck-sleeveless-sheath-dress/25697387M.html?lang=en_US,https://zzsu-060.dx.commercecloud.salesforce.com/on/demandware.static/-/Sites-apparel-m-catalog/default/dw244311a2/images/large/PG.10255870.JJ3WCXX.PZ.jpg
25697392M,Pleated Skirt.,109.0,Spring into a new season with this perfect side button smooth waist pleated skirt. Add a jacket or blouse for a perfect desk-to-dinner look. Spring into a new season with this perfect side button smooth waist pleated skirt. Add a jacket or blouse for a perfect desk-to-dinner look.,https://zzsu-060.dx.commercecloud.salesforce.com/s/RefArch/pleated-skirt/25697392M.html?lang=en_US,https://zzsu-060.dx.commercecloud.salesforce.com/on/demandware.static/-/Sites-apparel-m-catalog/default/dw79945b62/images/large/PG.10255878.JJ3WCXX.PZ.jpg
25697499M,Pleated Jacket.,139.0,Time to update your assortment with this great suit jacket. You will love its easy fit and classic look. Time to update your assortment with this great suit jacket. You will love its easy fit and classic look.,https://zzsu-060.dx.commercecloud.salesforce.com/s/RefArch/pleated-jacket/25697499M.html?lang=en_US,https://zzsu-060.dx.commercecloud.salesforce.com/on/demandware.static/-/Sites-apparel-m-catalog/default/dw973384a6/images/large/PG.10245334.JJ169XX.PZ.jpg
25697530M,Double Breasted Sleeveless Button Down Blouse.,74.0,Update your wardrobe with this ruffle sleeveless button down shirt. Add a new piece of Commerce Cloud Store jewelry and you will look fabulous Update your wardrobe with this ruffle sleeveless button down shirt. Add a new piece of Commerce Cloud Store jewelry and you will look fabulous,https://zzsu-060.dx.commercecloud.salesforce.com/s/RefArch/double-breasted-sleeveless-button-down-blouse/25697530M.html?lang=en_US,https://zzsu-060.dx.commercecloud.salesforce.com/on/demandware.static/-/Sites-apparel-m-catalog/default/dw0e40c1b2/images/large/PG.10245386.JJI15XX.PZ.jpg
25697544M,Stripe Button Down Shirt.,64.0,This Striped Button Down Shirt is an incredibly versatile blouse. We love it from nine-to-five and beyond. This Striped Button Down Shirt is an incredibly versatile blouse. We love it from nine-to-five and beyond.,https://zzsu-060.dx.commercecloud.salesforce.com/s/RefArch/stripe-button-down-shirt/25697544M.html?lang=en_US,https://zzsu-060.dx.commercecloud.salesforce.com/on/demandware.static/-/Sites-apparel-m-catalog/default/dwdeb4ff9e/images/large/PG.10245446.JJDB8XX.PZ.jpg
25697561M,Ruffle Front Blouse.,74.0,Ruffles are so in this season! You will love the way this looks! Ruffles are so in this season! You will love the way this looks!,https://zzsu-060.dx.commercecloud.salesforce.com/s/RefArch/ruffle-front-blouse/25697561M.html?lang=en_US,https://zzsu-060.dx.commercecloud.salesforce.com/on/demandware.static/-/Sites-apparel-m-catalog/default/dw115fdbc9/images/large/PG.10245478.JJAN5XX.PZ.jpg
25697578M,Straight Skirt.,69.0,Make way for this effortless skirt. Add a blouse or suit jacket to complete your look. Make way for this effortless skirt. Add a blouse or suit jacket to complete your look.,https://zzsu-060.dx.commercecloud.salesforce.com/s/RefArch/straight-skirt/25697578M.html?lang=en_US,https://zzsu-060.dx.commercecloud.salesforce.com/on/demandware.static/-/Sites-apparel-m-catalog/default/dw586a126b/images/large/PG.10245550.JJI15XX.PZ.jpg
25697587M,Straight Leg Pant.,79.0,One of JNY's bestsellers! We all love this pant! One of JNY's bestsellers! We all love this pant!,https://zzsu-060.dx.commercecloud.salesforce.com/s/RefArch/straight-leg-pant/25697587M.html?lang=en_US,https://zzsu-060.dx.commercecloud.salesforce.com/on/demandware.static/-/Sites-apparel-m-catalog/default/dwa21a436c/images/large/PG.10246050.JJ169XX.PZ.jpg
25697630M,Straight Ankle Pant.,79.0,Ankle pants looks so great with a tee and flats! Perfect casual look. Ankle pants looks so great with a tee and flats! Perfect casual look.,https://zzsu-060.dx.commercecloud.salesforce.com/s/RefArch/straight-ankle-pant/25697630M.html?lang=en_US,https://zzsu-060.dx.commercecloud.salesforce.com/on/demandware.static/-/Sites-apparel-m-catalog/default/dwbe5ede61/images/large/PG.10246102.JJ0DDXX.PZ.jpg
