id,name,price,description,url,imageurl
canon-powershot-s5-isM,Canon PowerShot S5 IS Digital Point and Shoot Camera,399.99,"The ultra-powerful 12x optical zoom on the PowerShot S5 IS means you'll get the shot you want with no compromise, yet that's only the beginning of what makes this camera so exciting. The S5 IS is loaded with many of Canon's latest advanced technologies including the DIGIC III Image Processor, so both still images and movies are rendered with fine detail and luminous clarity. And now ambitious photographers have even greater creative latitude thanks to an included hot shoe adapter that allows you to attach Canon Speedlite EX Series external flashes.",https://zzsu-060.dx.commercecloud.salesforce.com/s/RefArch/const111/electronics/digital%20cameras/canon-powershot-s5-isM.html?lang=en_US,https://zzsu-060.dx.commercecloud.salesforce.com/on/demandware.static/-/Sites-electronics-m-catalog/default/dw44c91d86/images/large/canon-powershot-s5-is.jpg
canon-powershot-sd1100-isM,Canon PowerShot SD1100 Digital Point and Shoot Camera,349.99,"Color communicates. It introduces you before you say a word, making the PowerShot SD1100 IS Digital ELPH the ultimate image-maker. Five fashion-forward hues expressed in pure aluminum add a new burst of excitement to Canon's Perpetual Curve design. Of course, a camera that brings out the best in you also delivers Canon's most advanced technology features. Call it style with substance, for a new level of picture-taking pleasure.",https://zzsu-060.dx.commercecloud.salesforce.com/s/RefArch/const111/electronics/digital%20cameras/canon-powershot-sd1100-isM.html?lang=en_US,https://zzsu-060.dx.commercecloud.salesforce.com/on/demandware.static/-/Sites-electronics-m-catalog/default/dwaff1e286/images/large/canon-powershot-sd1100-is.jpg
canon-powershot-sd990-isM,Canon PowerShot SD990 Digital Point and Shoot Camera,399.99,"When you're ready to experience a higher level of pace-setting technology and image brilliance, the PowerShot SD990 IS Digital ELPH is ready for you. One glance at the sleek, sculptured profile, and you know this is a camera driven by design and features. Style without compromise is the perfect complement to the ELPH model's most advanced feature lineup - engineering leadership that opens your eyes and imagination to the real potential and boundless pleasures of photography.",https://zzsu-060.dx.commercecloud.salesforce.com/s/RefArch/const111/electronics/digital%20cameras/canon-powershot-sd990-isM.html?lang=en_US,https://zzsu-060.dx.commercecloud.salesforce.com/on/demandware.static/-/Sites-electronics-m-catalog/default/dw35b4eec0/images/large/canon-powershot-sd990-is.jpg
creative-zen-vM,Creative ZEN V Digital Media Player,71.99,"The ZEN V player was designed for people like you—those who walk a step or two ahead of the pack. So don't be surprised when people take notice of your cool, colorful music and photo player.",https://zzsu-060.dx.commercecloud.salesforce.com/s/RefArch/const111/electronics/ipod%20%26%20mp3%20players/creative-zen-vM.html?lang=en_US,https://zzsu-060.dx.commercecloud.salesforce.com/on/demandware.static/-/Sites-electronics-m-catalog/default/dwbdb74e64/images/large/creative-zen-v.jpg
creative-zen-x-fiM,Creative ZEN X-Fi Digital Media Player,259.99,Experience your MP3 music as the artist originally intended with Creative ZEN X-Fi - the first MP3 player to restore the quality of compressed music with award-winning X-Fi Xtreme Fidelity Audio technology.,https://zzsu-060.dx.commercecloud.salesforce.com/s/RefArch/const111/electronics/ipod%20%26%20mp3%20players/creative-zen-x-fiM.html?lang=en_US,https://zzsu-060.dx.commercecloud.salesforce.com/on/demandware.static/-/Sites-electronics-m-catalog/default/dw32ed57d9/images/large/creative-zen-x-fi.jpg
easports-fight-night-round-3-xbox360M,Fight Night: Round 3 (for X-Box 360),59.99,"The highly acclaimed EA SPORTS Fight Night franchise, the undisputed champion of boxing videogames, delivers another hit with EA SPORTS Fight Night Round 3. Feel what it's like to hit—or be hit by—great champions such as Muhammad Ali and Oscar De La Hoya with film-quality graphics that showcase the most devastating punches seen in any game or movie. Outside the ring, establish intense rivalries by calling out opponents and triggering press conference brawls on your way to becoming boxing's greatest legend. EA SPORTS Fight Night Round 3—the closest thing to being in the ring without getting punched.",https://zzsu-060.dx.commercecloud.salesforce.com/s/RefArch/const111/electronics/gaming/games/easports-fight-night-round-3-xbox360M.html?lang=en_US,https://zzsu-060.dx.commercecloud.salesforce.com/on/demandware.static/-/Sites-electronics-m-catalog/default/dw177722a2/images/large/easports-fight-night-round-3-xbox360.jpg
easports-madden-nfl-09-wiiM,Madden NFL 09 (for Wii),49.99,"Now enhance the core skills areas of football and experience to match your playing style with the Madden NFL 09 Wii game from Electronic Arts™. An all-new Wii exclusive playcalling system featuring simplified one-button controls and new assisted player movement make Madden NFL 09 the most accessible Wii football game ever. This game is incorporated with All-New 5-on-5 Mode Neighborhood-style tackle football jumps to life exclusively on the Wii. The fast-paced game play and a smaller playing field deliver high-scoring games that are over-the-top and in-your-face. In these game players of all skill levels can be competitive by calling plays from three unique playbooks, ranging from Easy to Advanced. Intelligent Coach Tips provide instant feedback to help you become a better player on the fly. Control receivers and make spectacular catches or key possession receptions, or roam the secondary and jar the ball loose with big hits and ball-stripping tackles, as you indulge yourself in heart-thumping sporting action.",https://zzsu-060.dx.commercecloud.salesforce.com/s/RefArch/const111/electronics/gaming/games/easports-madden-nfl-09-wiiM.html?lang=en_US,https://zzsu-060.dx.commercecloud.salesforce.com/on/demandware.static/-/Sites-electronics-m-catalog/default/dw991fb20a/images/large/easports-madden-nfl-09-wii.jpg
easports-monopoly-ps3M,Monopoly Here and Now: The World Edition (for Sony PS3),59.99,"Celebrating over 70 years of family fun, the legendary property trading game MONOPOLY® is hitting video game consoles in a whole new way! The world’s most popular board game returns in 2008 with MONOPOLY® HERE & NOW: The World Edition, a modern makeover of the classic game. With a host of current-day cities and landmarks from all over the world, this new version will let players wheel and deal and compete to own some of the most recognized locales on Earth. EA brings this exciting new edition of the beloved board game to video game consoles for the first time along with entirely new features that focus on super-fast play, fun and interactive mini-games and four-player simultaneous gameplay. Players can now host the ultimate MONOPOLY night with family and friends.",https://zzsu-060.dx.commercecloud.salesforce.com/s/RefArch/const111/electronics/gaming/games/easports-monopoly-ps3M.html?lang=en_US,https://zzsu-060.dx.commercecloud.salesforce.com/on/demandware.static/-/Sites-electronics-m-catalog/default/dwbcae2d40/images/large/easports-monopoly-ps3.jpg
easports-nascar-09-ps3M,Nascar 09 (for Sony PS3),59.99,"Race your way with unprecedented adaptability and customization in NASCAR 09. As the sport's newest prodigy, NASCAR's four-time champion Jeff Gordon takes you under his wing and guides you through some of the key aspects of the game. Use his advice to your advantage when racing in an all-new Career mode or the Sprint Driver Challenges to earn reputation and become a NASCAR champion yourself. Create a racing credential, design a customized car, and get ready to race for premier contracts as you work your way to the top with NASCAR 09.",https://zzsu-060.dx.commercecloud.salesforce.com/s/RefArch/const111/electronics/gaming/games/easports-nascar-09-ps3M.html?lang=en_US,https://zzsu-060.dx.commercecloud.salesforce.com/on/demandware.static/-/Sites-electronics-m-catalog/default/dw5f7b768e/images/large/easports-nascar-09-ps3.jpg
fall-lookM,Fall Look,36.0,Fall Look,https://zzsu-060.dx.commercecloud.salesforce.com/s/RefArch/const111/womens/clothing/outfits/fall-lookM.html?lang=en_US,https://zzsu-060.dx.commercecloud.salesforce.com/on/demandware.static/-/Sites-apparel-m-catalog/default/dw708521f3/images/large/PG.10241411.JJZ01XX.PZ.jpg
garmin--gpsmap-296M,Garmin GPSMAP® 296 Portable GPS Unit,459.99,"Taking terrain awareness to a whole new level, the GPSMAP 296 is a color aviation portable with built-in terrain mapping and alerting.",https://zzsu-060.dx.commercecloud.salesforce.com/s/RefArch/const111/electronics/gps%20navigation/garmin--gpsmap-296M.html?lang=en_US,https://zzsu-060.dx.commercecloud.salesforce.com/on/demandware.static/-/Sites-electronics-m-catalog/default/dwa46ad186/images/large/garmin--gpsmap-296.jpg
garmin--gpsmap-496M,Garmin GPSMAP® 496 Portable GPS Unit,559.99,"Fly smarter and safer with the GPSMAP 496 on board. This “know-it-all” mini-MFD puts more power and information at your fingertips than any other portable handheld in the history of aviation. Similar to the GPSMAP 396, the 496 combines satellite weather with a detailed color map and terrain alerting, then takes it up a notch with even more high-end software and features. The 496 is a “must have” for any pilot.",https://zzsu-060.dx.commercecloud.salesforce.com/s/RefArch/const111/electronics/gps%20navigation/garmin--gpsmap-496M.html?lang=en_US,https://zzsu-060.dx.commercecloud.salesforce.com/on/demandware.static/-/Sites-electronics-m-catalog/default/dw0e34a87f/images/large/garmin--gpsmap-496.jpg
garmin--gpsmap-696M,Garmin GPSMAP® 696 Portable GPS Unit,395.99,"Meet our ultimate portable MFD: the GPSMAP 696, an all-in-one navigator designed exclusively for aviation. Featuring a large screen, detailed electronic charts and real-time weather, the 696 is your own personal avionics system.",https://zzsu-060.dx.commercecloud.salesforce.com/s/RefArch/const111/electronics/gps%20navigation/garmin--gpsmap-696M.html?lang=en_US,https://zzsu-060.dx.commercecloud.salesforce.com/on/demandware.static/-/Sites-electronics-m-catalog/default/dw99089f58/images/large/garmin--gpsmap-696.jpg
garmin-etrex-hM,Garmin eTrex® H Portable GPS Unit,139.99,"Perfect for outdoor enthusiasts on a budget, eTrex H comes with a high-sensitivity GPS receiver that locks onto satellite signals quickly and maintains accuracy — even in the toughest conditions. And just like the popular eTrex, this little yellow wonder combines an intuitive interface and a rugged exterior into a lightweight handheld that fits in the palm of your hand.",https://zzsu-060.dx.commercecloud.salesforce.com/s/RefArch/const111/electronics/gps%20navigation/garmin-etrex-hM.html?lang=en_US,https://zzsu-060.dx.commercecloud.salesforce.com/on/demandware.static/-/Sites-electronics-m-catalog/default/dwdfd30d0b/images/large/garmin-etrex-h.jpg
garmin-foretrex-101M,Garmin Foretrex® 101 Portable GPS Unit,83.99,"The Foretrex 101 deliver hands-free GPS navigation in a lightweight, waterproof package. Lighter than many watches, this wrist-mounted navigator runs on 2 AAA batteries and is ideal for kayaking, hang gliding, skiing or any other activity that requires both hands free.",https://zzsu-060.dx.commercecloud.salesforce.com/s/RefArch/const111/electronics/gps%20navigation/garmin-foretrex-101M.html?lang=en_US,https://zzsu-060.dx.commercecloud.salesforce.com/on/demandware.static/-/Sites-electronics-m-catalog/default/dw7ed12bb6/images/large/garmin-foretrex-101.jpg
garmin-geko-301M,Garmin Geko 301 Portable GPS Unit,246.99,"One of the smallest and lightest GPS navigators around, Geko 301 adds a built-in electronic compass and barometric altimeter",https://zzsu-060.dx.commercecloud.salesforce.com/s/RefArch/const111/electronics/gps%20navigation/garmin-geko-301M.html?lang=en_US,https://zzsu-060.dx.commercecloud.salesforce.com/on/demandware.static/-/Sites-electronics-m-catalog/default/dwafac4a74/images/large/garmin-geko-301.jpg
garmin-gps-60M,Garmin GPS 60™ Portable GPS Unit,192.99,"Backwoods, boundary waters, blue highways — the GPS 60 is your trusted guide to the great outdoors. The GPS 60 and its counterpart, the GPSMAP 60, are packed with several of the features found in the 60-series colour navigators, but sport an affordable, high-resolution monochrome display for outdoor enthusiasts on a budget.",https://zzsu-060.dx.commercecloud.salesforce.com/s/RefArch/const111/electronics/gps%20navigation/garmin-gps-60M.html?lang=en_US,https://zzsu-060.dx.commercecloud.salesforce.com/on/demandware.static/-/Sites-electronics-m-catalog/default/dw32e3f3bc/images/large/garmin-gps-60.jpg
garmin-gpsmap-96cM,Garmin GPSMAP® 96C Portable GPS Unit,359.99,The portable color GPSMAP 96C along with the grayscale GPSMAP 96 combine a pilot-friendly operating system with powerful navigation features and great value — giving you the freedom to go anywhere.,https://zzsu-060.dx.commercecloud.salesforce.com/s/RefArch/const111/electronics/gps%20navigation/garmin-gpsmap-96cM.html?lang=en_US,https://zzsu-060.dx.commercecloud.salesforce.com/on/demandware.static/-/Sites-electronics-m-catalog/default/dw8a8e76ec/images/large/garmin-gpsmap-96c.jpg
garmin-nuvi-200M,Garmin nuvi® 200 Portable GPS Unit,199.99,"Street smart and ultra-cool, you can count on nüvi 200 to get you there on time and in style. This sleek navigator and travel companion comes with preloaded maps for the lower 48 states, Hawaii and Puerto Rico or regional coverage in other areas. Like the rest of the nüvi 200-series, nüvi 200 is affordably priced and simple to use.",https://zzsu-060.dx.commercecloud.salesforce.com/s/RefArch/const111/electronics/gps%20navigation/garmin-nuvi-200M.html?lang=en_US,https://zzsu-060.dx.commercecloud.salesforce.com/on/demandware.static/-/Sites-electronics-m-catalog/default/dw2f4ff9ba/images/large/garmin-nuvi-200.jpg
garmin-nuvi-255M,Garmin nuvi® 255 Portable GPS Unit,199.99,"For peace of mind on the go, nüvi 255 leads the way with voice-prompted turn-by-turn directions that speak street names and optional MSN® Direct to get you there on time and keep you informed. It's packed with millions of destinations and maps for North America or Europe. Like the rest of the compact nüvi 2x5-series, this portable navigator is priced right and ultra-easy to use.",https://zzsu-060.dx.commercecloud.salesforce.com/s/RefArch/const111/electronics/gps%20navigation/garmin-nuvi-255M.html?lang=en_US,https://zzsu-060.dx.commercecloud.salesforce.com/on/demandware.static/-/Sites-electronics-m-catalog/default/dw6d0a2c06/images/large/garmin-nuvi-255.jpg
garmin-nuvi-5000M,Garmin nuvi® 5000 Portable GPS Unit,719.99,"Get big-time navigation and mapping with the large screen nüvi 5000. This super-sized navigator is designed for RV and truck drivers and gives a big picture of the route ahead without obstructing your view. It features a whopping 5.2 inch display, preloaded maps, an FM transmitter and lots of entertainment features for fun on the open road.",https://zzsu-060.dx.commercecloud.salesforce.com/s/RefArch/const111/electronics/gps%20navigation/garmin-nuvi-5000M.html?lang=en_US,https://zzsu-060.dx.commercecloud.salesforce.com/on/demandware.static/-/Sites-electronics-m-catalog/default/dwd27e3430/images/large/garmin-nuvi-5000.jpg
garmin-nuvi-750M,Garmin nuvi® 750 Portable GPS Unit,311.99,"Sleek and wide, nüvi 750 leads the way with advanced navigation features, a colorful widescreen display, preloaded maps, an FM transmitter, a travel kit and more. Like the rest of the wide nüvi 700-series, its premium navigation capabilities, like route planning and an emergency locator, give you peace of mind on the go.",https://zzsu-060.dx.commercecloud.salesforce.com/s/RefArch/const111/electronics/gps%20navigation/garmin-nuvi-750M.html?lang=en_US,https://zzsu-060.dx.commercecloud.salesforce.com/on/demandware.static/-/Sites-electronics-m-catalog/default/dw5e8ca441/images/large/garmin-nuvi-750.jpg
garmin-nuvi-880M,Garmin nuvi® 880 Portable GPS Unit,899.99,"Speak commands and get on-demand travel info from MSN® Direct with nüvi 880. This widescreen navigator features voice-activated navigation, preloaded maps, hands-free calling and an FM transmitter — plus real-time local weather, traffic, movie times, gas prices, stock information, local news and events. Like the rest of the wide nüvi 800-series, you can navigate with your voice for on-the-go convenience.",https://zzsu-060.dx.commercecloud.salesforce.com/s/RefArch/const111/electronics/gps%20navigation/garmin-nuvi-880M.html?lang=en_US,https://zzsu-060.dx.commercecloud.salesforce.com/on/demandware.static/-/Sites-electronics-m-catalog/default/dwa8ad44b0/images/large/garmin-nuvi-880.jpg
garmin-streetpilot-2820M,Garmin StreetPilot® 2820 Portable GPS Unit,359.99,"With built-in Bluetooth® capability, preloaded street maps and real-time traffic capabilities, the StreetPilot 2820 is the ideal road companion for your car or motorcycle.",https://zzsu-060.dx.commercecloud.salesforce.com/s/RefArch/const111/electronics/gps%20navigation/garmin-streetpilot-2820M.html?lang=en_US,https://zzsu-060.dx.commercecloud.salesforce.com/on/demandware.static/-/Sites-electronics-m-catalog/default/dw7ababe32/images/large/garmin-streetpilot-2820.jpg
garmin-streetpilot-7200M,Garmin StreetPilot® 7200 Portable GPS Unit,899.99,"StreetPilot 7200 comes ready to go right out of the box with preloaded City Navigator® NT street maps, including a hefty points of interest (POIs) database with motels, restaurants, fuel, ATMs and more. Simply touch the sunlight-readable color screen or use the remote to enter a destination, and the 7200 takes you there with turn-by-turn voice directions. It even announces the name of exits and streets so you never have to take your eyes off the road. In addition, the 7200 accepts custom points of interest (POIs), such as school zones and safety cameras, and lets you set proximity alerts to warn you of upcoming POI",https://zzsu-060.dx.commercecloud.salesforce.com/s/RefArch/const111/electronics/gps%20navigation/garmin-streetpilot-7200M.html?lang=en_US,https://zzsu-060.dx.commercecloud.salesforce.com/on/demandware.static/-/Sites-electronics-m-catalog/default/dwbcd12301/images/large/garmin-streetpilot-7200.jpg
garmin-zumo-450M,Garmin zumo® 450 Portable GPS Unit,659.99,"Rugged and ready to ride, zu-mo 450 is your faithful guide to the open road. With glove-friendly, left-handed controls, preloaded street maps and a sunlight-readable screen, this waterproof navigator is made for motorcycles. zu-mo 450 includes many of the 550's motorcycle-friendly features, minus Bluetooth® wireless technology, text-to-speech and XM Satellite radio, at a price that won't break your budget.",https://zzsu-060.dx.commercecloud.salesforce.com/s/RefArch/const111/electronics/gps%20navigation/garmin-zumo-450M.html?lang=en_US,https://zzsu-060.dx.commercecloud.salesforce.com/on/demandware.static/-/Sites-electronics-m-catalog/default/dwfe87594c/images/large/garmin-zumo-450.jpg
gpx-ml638bM,GPX ML638 Digital Media Player,53.99,"Much more than a music player! This sleek video/audio player also brings video and photos to life on the 1.5"" diagonal color display. This pocket-sized entertainer also displays song and artist info so you're always in the know. You can even use the device as a USB mass storage device for important files. From GPX.",https://zzsu-060.dx.commercecloud.salesforce.com/s/RefArch/const111/electronics/ipod%20%26%20mp3%20players/gpx-ml638bM.html?lang=en_US,https://zzsu-060.dx.commercecloud.salesforce.com/on/demandware.static/-/Sites-electronics-m-catalog/default/dwc587b82a/images/large/gpx-ml638b.jpg
gpx-ml838bM,GPX ML838 Digital Media Player,79.99,"Mobile amusement. This cool digital video/audio player brings music, video, and photos to life on the impressive 2.4"" diagonal color TFT display. Listen to tunes, news, and talk radio with the FM radio, and immediately capture thoughts and notes with the voice recording function. Enhanced sound with SRS WOW HD technology delivers crisp audio no matter what you're listening to. From GPX",https://zzsu-060.dx.commercecloud.salesforce.com/s/RefArch/const111/electronics/ipod%20%26%20mp3%20players/gpx-ml838bM.html?lang=en_US,https://zzsu-060.dx.commercecloud.salesforce.com/on/demandware.static/-/Sites-electronics-m-catalog/default/dwf1a5b241/images/large/gpx-ml838b.jpg
in-store-setM,In store set,99.99,Group of items that are available for in store pick up Pants Pants More Pants,https://zzsu-060.dx.commercecloud.salesforce.com/s/RefArch/const111/womens/clothing/outfits/in-store-setM.html?lang=en_US,https://zzsu-060.dx.commercecloud.salesforce.com/on/demandware.static/-/Sites-apparel-m-catalog/default/dw74df7f1d/images/large/90011212_001_0.jpg
kodak-c1013M,Kodak EasyShare C1013 Digital Point and Shoot Camera,129.95,Great shots. Exceptional price.,https://zzsu-060.dx.commercecloud.salesforce.com/s/RefArch/const111/electronics/digital%20cameras/kodak-c1013M.html?lang=en_US,https://zzsu-060.dx.commercecloud.salesforce.com/on/demandware.static/-/Sites-electronics-m-catalog/default/dw0b230bad/images/large/kodak-c1013.jpg
kodak-v1273M,Kodak EasyShare V1273 Digital Point and Shoot Camera,229.95,Taking great pictures is just the beginning.,https://zzsu-060.dx.commercecloud.salesforce.com/s/RefArch/const111/electronics/digital%20cameras/kodak-v1273M.html?lang=en_US,https://zzsu-060.dx.commercecloud.salesforce.com/on/demandware.static/-/Sites-electronics-m-catalog/default/dw44fd8617/images/large/kodak-v1273.jpg
kodak-z1015M,Kodak EasyShare Z1015 Digital Point and Shoot Camera,299.95,Capture more—up close or far away.,https://zzsu-060.dx.commercecloud.salesforce.com/s/RefArch/const111/electronics/digital%20cameras/kodak-z1015M.html?lang=en_US,https://zzsu-060.dx.commercecloud.salesforce.com/on/demandware.static/-/Sites-electronics-m-catalog/default/dw53fdd528/images/large/kodak-z1015.jpg
kodak-z712M,Kodak EasyShare Z712 Digital Point and Shoot Camera,139.96,Superior performance. Superb picture quality.,https://zzsu-060.dx.commercecloud.salesforce.com/s/RefArch/const111/electronics/digital%20cameras/kodak-z712M.html?lang=en_US,https://zzsu-060.dx.commercecloud.salesforce.com/on/demandware.static/-/Sites-electronics-m-catalog/default/dw669e8128/images/large/kodak-z712.jpg
kodak-z8612M,Kodak EasyShare Z8612 Digital Point and Shoot Camera,199.95,Powerful zoom. Remarkable clarity.,https://zzsu-060.dx.commercecloud.salesforce.com/s/RefArch/const111/electronics/digital%20cameras/kodak-z8612M.html?lang=en_US,https://zzsu-060.dx.commercecloud.salesforce.com/on/demandware.static/-/Sites-electronics-m-catalog/default/dwd222b673/images/large/kodak-z8612.jpg
lucasarts-lego-indiana-jones-original-adventure-wiiM,Lego Indian Jones: The Original Adventure (for Wii),49.99,"Once again rendering a beloved George Lucas creation in LEGOs, LEGO Indiana Jones features the intrepid explorer in an epic adventure based on the film series. Developed by the same team that created the LEGO Star Wars series, LEGO Indiana Jones presents a tongue-in-cheek take on the first three cinematic adventures of pop culture's most iconic archaeologist, including Indiana Jones and the Raiders of the Lost Ark, Indiana Jones and the Temple of Doom and Indiana Jones and the Last Crusade.",https://zzsu-060.dx.commercecloud.salesforce.com/s/RefArch/const111/electronics/gaming/games/lucasarts-lego-indiana-jones-original-adventure-wiiM.html?lang=en_US,https://zzsu-060.dx.commercecloud.salesforce.com/on/demandware.static/-/Sites-electronics-m-catalog/default/dwe2fc5fc2/images/large/lucasarts-lego-indiana-jones-original-adventure-wii.jpg
lucasarts-star-wars-the-force-unleashed-pspM,Star Wars: The Force Unleased (for Sony PSP),49.99,"The Star Wars saga continues in Star Wars: The Force Unleashed. You are Darth Vader's Secret Apprentice! The Dark Lord of the Sith himself has trained you to use a lightsaber and unleash the power of the Force, but now your destiny is your own. Will you join Vader as the next great Sith, or will you choose to defend peace and justice as a noble Jedi Knight? The expansive story, created under direction from George Lucas, is set during the largely unexplored era between Star Wars: Episode III Revenge of the Sith and Star Wars: Episode IV A New Hope.",https://zzsu-060.dx.commercecloud.salesforce.com/s/RefArch/const111/electronics/gaming/games/lucasarts-star-wars-the-force-unleashed-pspM.html?lang=en_US,https://zzsu-060.dx.commercecloud.salesforce.com/on/demandware.static/-/Sites-electronics-m-catalog/default/dw5343b1eb/images/large/lucasarts-star-wars-the-force-unleashed-psp.jpg
microsoft-xbox360-bundleM,Xbox 360 Bundle,299.99,,https://zzsu-060.dx.commercecloud.salesforce.com/s/RefArch/const111/electronics/gaming/game%20consoles/microsoft-xbox360-bundleM.html?lang=en_US,https://zzsu-060.dx.commercecloud.salesforce.com/on/demandware.static/-/Sites-electronics-m-catalog/default/dwb2886b7b/images/large/microsoft-xbox360-bundle.jpg
microsoft-xbox360-consoleM,Microsoft X-Box 360 Game Console,199.99,"Xbox 360 puts you at the center of the most exciting games and entertainment experiences on earth. Xbox 360 not only has the best, highest-rated games, and the most robust title library, but it also offers access to the industry-leading Xbox LIVE service and tailored digital entertainment experiences that revolve around you.",https://zzsu-060.dx.commercecloud.salesforce.com/s/RefArch/const111/electronics/gaming/game%20consoles/microsoft-xbox360-consoleM.html?lang=en_US,https://zzsu-060.dx.commercecloud.salesforce.com/on/demandware.static/-/Sites-electronics-m-catalog/default/dw5185553f/images/large/microsoft-xbox360-console.jpg
