id,name,price,description,url,imageurl
25589220M,Animal print Boat Neck Sweater,80.99,This dolman sleeve animal print top is a Commerce Cloud Store favorite! It is a perfect outfit completer that is sure to turn heads This dolman sleeve animal print top is a Commerce Cloud Store favorite! It is a perfect outfit completer that is sure to turn heads,https://zzsu-060.dx.commercecloud.salesforce.com/s/RefArch/animal-print-boat-neck-sweater/25589220M.html?lang=en_US,https://zzsu-060.dx.commercecloud.salesforce.com/on/demandware.static/-/Sites-apparel-m-catalog/default/dw62f644a0/images/large/PG.10235006.JJZ01XX.PZ.jpg
25589225M,3/4 Sleeve V-Neck Cardigan,88.99,Our best selling cardigan has been updated with a textured pattern. Pair it with a great Commerce Cloud Store bottom and you are ready for the boardroom. Our best selling cardigan has been updated with a textured pattern. Pair it with a great Commerce Cloud Store bottom and you are ready for the boardroom.,https://zzsu-060.dx.commercecloud.salesforce.com/s/RefArch/3/4-sleeve-v-neck-cardigan/25589225M.html?lang=en_US,https://zzsu-060.dx.commercecloud.salesforce.com/on/demandware.static/-/Sites-apparel-m-catalog/default/dw1bb041b8/images/large/PG.10235066.JJBG9XX.PZ.jpg
25589233M,Scoop Neck Tee,73.99,We've update our infamous layering tee in a new pattern. Grab a layering tee to wear on its own or under a jacket,https://zzsu-060.dx.commercecloud.salesforce.com/s/RefArch/scoop-neck-tee/25589233M.html?lang=en_US,https://zzsu-060.dx.commercecloud.salesforce.com/on/demandware.static/-/Sites-apparel-m-catalog/default/dwec13cc33/images/large/PG.10235338.JJW19A7.PZ.jpg
25589266M,Belted Ribbed Boat Neck Sweater,79.0,We've updated our 3/4 sleeve boat neck with a belt for a new look. Pick one in this session's favorite colors!,https://zzsu-060.dx.commercecloud.salesforce.com/s/RefArch/belted-ribbed-boat-neck-sweater/25589266M.html?lang=en_US,https://zzsu-060.dx.commercecloud.salesforce.com/on/demandware.static/-/Sites-apparel-m-catalog/default/dw4826462d/images/large/PG.10236662.JJ3WCXX.PZ.jpg
25589283M,Draped Neck Top,79.0,We've updated our classic draped neck top in this seasons newest color. Layer it under a great Commerce Cloud Store jacket for desk-to-dinner.,https://zzsu-060.dx.commercecloud.salesforce.com/s/RefArch/draped-neck-top/25589283M.html?lang=en_US,https://zzsu-060.dx.commercecloud.salesforce.com/on/demandware.static/-/Sites-apparel-m-catalog/default/dw749455b9/images/large/PG.10236670.JJ555XX.PZ.jpg
25589335M,Ruffle Front Cardigan,89.0,Our newest ruffle front cardigan is a terrific layering piece for skirts or slacks. It is a great style to wear for day thru evening.,https://zzsu-060.dx.commercecloud.salesforce.com/s/RefArch/ruffle-front-cardigan/25589335M.html?lang=en_US,https://zzsu-060.dx.commercecloud.salesforce.com/on/demandware.static/-/Sites-apparel-m-catalog/default/dw5e8f47ca/images/large/PG.10236682.JJ3WCXX.PZ.jpg
25589355M,Scoop Neck Shell,59.0,Our classic layering piece is perfect for any season. Wear it on its own or under a great Commerce Cloud Store jacket.,https://zzsu-060.dx.commercecloud.salesforce.com/s/RefArch/scoop-neck-shell/25589355M.html?lang=en_US,https://zzsu-060.dx.commercecloud.salesforce.com/on/demandware.static/-/Sites-apparel-m-catalog/default/dw3b914477/images/large/PG.10236690.JJ3WCXX.PZ.jpg
25589371M,Cable Knit Shell,69.0,We've updated our classic shell with a cable pattern. Grab a few for perfect outfit completers.,https://zzsu-060.dx.commercecloud.salesforce.com/s/RefArch/cable-knit-shell/25589371M.html?lang=en_US,https://zzsu-060.dx.commercecloud.salesforce.com/on/demandware.static/-/Sites-apparel-m-catalog/default/dwa93c6558/images/large/PG.10236698.JJ3WCXX.PZ.jpg
25589397M,Classic Print Blouse,65.99,Wow! This is a show stopper! We've updated our classic button down blouse in this season's latest print. Add a great piece of Commerce Cloud Store jewelry and you are ready for desk-to-dinner.,https://zzsu-060.dx.commercecloud.salesforce.com/s/RefArch/classic-print-blouse/25589397M.html?lang=en_US,https://zzsu-060.dx.commercecloud.salesforce.com/on/demandware.static/-/Sites-apparel-m-catalog/default/dw28230e27/images/large/PG.10237830.JJFD2A8.PZ.jpg
25589408M,Tie Front Animal Print Dress,110.99,We love our newest animal print tie front soft chiffon dress. Dress it up with anew piece of Commerce Cloud Store jewelry and you are set from nine-to-five and beyond. We love our newest animal print tie front soft chiffon dress. Dress it up with anew piece of Commerce Cloud Store jewelry and you are set from nine-to-five and beyond.,https://zzsu-060.dx.commercecloud.salesforce.com/s/RefArch/tie-front-animal-print-dress/25589408M.html?lang=en_US,https://zzsu-060.dx.commercecloud.salesforce.com/on/demandware.static/-/Sites-apparel-m-catalog/default/dwe3268ec3/images/large/PG.10237834.JJFD2B0.PZ.jpg
25589419M,Slim Floral Skirt,73.99,Wow! You will turn heads in this floral slim cut skirt. Add a matching Commerce Cloud Store top and you are ready for desk-to-dinner.,https://zzsu-060.dx.commercecloud.salesforce.com/s/RefArch/slim-floral-skirt/25589419M.html?lang=en_US,https://zzsu-060.dx.commercecloud.salesforce.com/on/demandware.static/-/Sites-apparel-m-catalog/default/dwf28618a9/images/large/PG.10225656.JJ3WDXX.PZ.jpg
25589444M,Floral Cap Sleeve Blouse,65.99,We've updated one of our favorite Cap sleeve blouses in a vibrant floral print. Match it with a great Commerce Cloud Store bottom and you are set to go.,https://zzsu-060.dx.commercecloud.salesforce.com/s/RefArch/floral-cap-sleeve-blouse/25589444M.html?lang=en_US,https://zzsu-060.dx.commercecloud.salesforce.com/on/demandware.static/-/Sites-apparel-m-catalog/default/dw906704b4/images/large/PG.10227177.JJ5ABXX.PZ.jpg
25589481M,Sleeveless Sheath Dress,103.99,We are obsessed with our updated classic sheath dress. This is our classic sheath dress in this season's latest print. Add a great piece of Commerce Cloud Store jewelry and you are ready for desk-to-dinner.,https://zzsu-060.dx.commercecloud.salesforce.com/s/RefArch/sleeveless-sheath-dress/25589481M.html?lang=en_US,https://zzsu-060.dx.commercecloud.salesforce.com/on/demandware.static/-/Sites-apparel-m-catalog/default/dw3d1fc855/images/large/PG.10237562.JJ3WDXX.PZ.jpg
25589489M,Button Front Jacket,219.0,A classic long sleeve jacket looks new again. Add a matching pant for a perfect look from nine-to-five and beyond. A classic long sleeve jacket looks new again. Add a matching pant for a perfect look from nine-to-five and beyond.,https://zzsu-060.dx.commercecloud.salesforce.com/s/RefArch/button-front-jacket/25589489M.html?lang=en_US,https://zzsu-060.dx.commercecloud.salesforce.com/on/demandware.static/-/Sites-apparel-m-catalog/default/dw3fce49f5/images/large/PG.10227345.JJ6NAA9.PZ.jpg
25589500M,Notch Collar Button Down Jacket,209.0,Our best selling three-button jacket has been updated in this season's new color. Pair it with a great Commerce Cloud Store bottom and you are ready for the boardroom. Our best selling three-button jacket has been updated in this season's new color. Pair it with a great Commerce Cloud Store bottom and you are ready for the boardroom.,https://zzsu-060.dx.commercecloud.salesforce.com/s/RefArch/notch-collar-button-down-jacket/25589500M.html?lang=en_US,https://zzsu-060.dx.commercecloud.salesforce.com/on/demandware.static/-/Sites-apparel-m-catalog/default/dw2487e67a/images/large/PG.10227925.JJ6NAA9.PZ.jpg
25589508M,Flat Front Classic Pant,114.0,Sharpen up your office style with this flat front classic fit pant.,https://zzsu-060.dx.commercecloud.salesforce.com/s/RefArch/flat-front-classic-pant/25589508M.html?lang=en_US,https://zzsu-060.dx.commercecloud.salesforce.com/on/demandware.static/-/Sites-apparel-m-catalog/default/dw91498865/images/large/PG.10227965.JJ334XX.PZ.jpg
25589526M,Flat Front Pant,114.0,"Classically designed, this pin striped pant is perfect to pair with a matching Commerce Cloud Store jacket!",https://zzsu-060.dx.commercecloud.salesforce.com/s/RefArch/flat-front-pant/25589526M.html?lang=en_US,https://zzsu-060.dx.commercecloud.salesforce.com/on/demandware.static/-/Sites-apparel-m-catalog/default/dw1cee2cbe/images/large/PG.10227969.JJ6NAA9.PZ.jpg
25589534M,Floral Pencil Skirt,99.0,Make way for this effortless skirt. Add a blouse or suit jacket to complete your look. Make way for this effortless skirt. Add a blouse or suit jacket to complete your look.,https://zzsu-060.dx.commercecloud.salesforce.com/s/RefArch/floral-pencil-skirt/25589534M.html?lang=en_US,https://zzsu-060.dx.commercecloud.salesforce.com/on/demandware.static/-/Sites-apparel-m-catalog/default/dwb89007c9/images/large/PG.10227989.JJ9TSA0.PZ.jpg
25589545M,2 Button Front Jacket,189.0,Jackets are always in style and are great for creating a polished look.,https://zzsu-060.dx.commercecloud.salesforce.com/s/RefArch/2-button-front-jacket/25589545M.html?lang=en_US,https://zzsu-060.dx.commercecloud.salesforce.com/on/demandware.static/-/Sites-apparel-m-catalog/default/dw75814166/images/large/PG.10229382.JJG94A0.PZ.jpg
25589556M,Sleeveless Pleated Front Blouse,74.0,This sleeveless pleated front blouse is an incredibly versatile blouse. We love it from nine-to-five and beyond. This sleeveless pleated front blouse is an incredibly versatile blouse. We love it from nine-to-five and beyond.,https://zzsu-060.dx.commercecloud.salesforce.com/s/RefArch/sleeveless-pleated-front-blouse/25589556M.html?lang=en_US,https://zzsu-060.dx.commercecloud.salesforce.com/on/demandware.static/-/Sites-apparel-m-catalog/default/dwfd6435dd/images/large/PG.10230464.JJG94A0.PZ.jpg
25589582M,Open Front Cardigan,119.0,Our best selling cardigan has been updated with a textured pattern. Pair it with its matching shell and you are ready for the boardroom. Our best selling cardigan has been updated with a textured pattern. Pair it with its matching shell and you are ready for the boardroom.,https://zzsu-060.dx.commercecloud.salesforce.com/s/RefArch/open-front-cardigan/25589582M.html?lang=en_US,https://zzsu-060.dx.commercecloud.salesforce.com/on/demandware.static/-/Sites-apparel-m-catalog/default/dw6434da75/images/large/PG.10234882.JJZ01XX.PZ.jpg
25589587M,Sleeveless Shell,74.0,Our best selling shell has been updated with a textured pattern. Pair it with its matching cardigan and you are ready for the boardroom. Our best selling shell has been updated with a textured pattern. Pair it with its matching cardigan and you are ready for the boardroom.,https://zzsu-060.dx.commercecloud.salesforce.com/s/RefArch/sleeveless-shell/25589587M.html?lang=en_US,https://zzsu-060.dx.commercecloud.salesforce.com/on/demandware.static/-/Sites-apparel-m-catalog/default/dwe1cda6d1/images/large/PG.10234922.JJZ01XX.PZ.jpg
25589592M,Rainforest Cardigan,99.0,Our best selling cardigan has been updated with a rainforest pattern. Pair it with its matching shell and you are ready for the boardroom. Our best selling cardigan has been updated with a rainforest pattern. Pair it with its matching shell and you are ready for the boardroom.,https://zzsu-060.dx.commercecloud.salesforce.com/s/RefArch/rainforest-cardigan/25589592M.html?lang=en_US,https://zzsu-060.dx.commercecloud.salesforce.com/on/demandware.static/-/Sites-apparel-m-catalog/default/dwf4f83170/images/large/PG.10235010.JJZ01XX.PZ.jpg
25589597M,Rainforest Shell,74.0,Our best selling shell has been updated with a rainforest pattern. Pair it with its matching cardigan and you are ready for the boardroom. Our best selling shell has been updated with a rainforest pattern. Pair it with its matching cardigan and you are ready for the boardroom.,https://zzsu-060.dx.commercecloud.salesforce.com/s/RefArch/rainforest-shell/25589597M.html?lang=en_US,https://zzsu-060.dx.commercecloud.salesforce.com/on/demandware.static/-/Sites-apparel-m-catalog/default/dw1b014db0/images/large/PG.10235050.JJZ01XX.PZ.jpg
25589602M,One Button 3/4 Sleeve Cardigan,129.0,"A great knit is the ultimate complement to any wardrobe. This 3/4 sleeve, stand collar knit cardigan is a must have. A great knit is the ultimate complement to any wardrobe. This 3/4 sleeve, stand collar knit cardigan is a must have.",https://zzsu-060.dx.commercecloud.salesforce.com/s/RefArch/one-button-3/4-sleeve-cardigan/25589602M.html?lang=en_US,https://zzsu-060.dx.commercecloud.salesforce.com/on/demandware.static/-/Sites-apparel-m-catalog/default/dw42c6a46c/images/large/PG.10236702.JJ334XX.PZ.jpg
25589636M,No-Iron Easy Care Sleeveless Striped Shawl Collar Blouse,47.99,This classic no-iron easy care sleeveless blouse is perfect on it's own or under a jacket. It is truly a classic basic that is a must have in every wardrobe.,https://zzsu-060.dx.commercecloud.salesforce.com/s/RefArch/no-iron-easy-care-sleeveless-striped-shawl-collar-blouse/25589636M.html?lang=en_US,https://zzsu-060.dx.commercecloud.salesforce.com/on/demandware.static/-/Sites-apparel-m-catalog/default/dw8bc02ef9/images/large/PG.10233657.JJ2DHXX.PZ.jpg
25589644M,Slim Pant,99.0,Nothing is better than a perfect fit pant that slims your silhouette! Try this contouring pant for a workplace essential. Nothing is better than a perfect fit pant that slims your silhouette! Try this contouring pant for a workplace essential.,https://zzsu-060.dx.commercecloud.salesforce.com/s/RefArch/slim-pant/25589644M.html?lang=en_US,https://zzsu-060.dx.commercecloud.salesforce.com/on/demandware.static/-/Sites-apparel-m-catalog/default/dw6ddbf36d/images/large/PG.10240098.JJ3WCXX.PZ.jpg
25589652M,Flat Front Pant,99.0,This classic pant is a must for every wardrobe. It's perfect from day-to-dinner. This classic pant is a must for every wardrobe. It's perfect from day-to-dinner.,https://zzsu-060.dx.commercecloud.salesforce.com/s/RefArch/flat-front-pant/25589652M.html?lang=en_US,https://zzsu-060.dx.commercecloud.salesforce.com/on/demandware.static/-/Sites-apparel-m-catalog/default/dw2572770d/images/large/PG.10240166.JJ3WCXX.PZ.jpg
25589712M,Tie Front Blouse,73.99,This sensational short sleeve tie front blouse is our favorite item of the season. Pair this blouse with a great trouser or skirt.,https://zzsu-060.dx.commercecloud.salesforce.com/s/RefArch/tie-front-blouse/25589712M.html?lang=en_US,https://zzsu-060.dx.commercecloud.salesforce.com/on/demandware.static/-/Sites-apparel-m-catalog/default/dw388800ec/images/large/PG.10244525.JJ3WDXX.PZ.jpg
25589753M,Pack-And-Go Dress,129.0,"What a perfect dress for business travel. Pack this mock wrap sleek knit dress in a suitcase, and it will pop out ready to wear.",https://zzsu-060.dx.commercecloud.salesforce.com/s/RefArch/pack-and-go-dress/25589753M.html?lang=en_US,https://zzsu-060.dx.commercecloud.salesforce.com/on/demandware.static/-/Sites-apparel-m-catalog/default/dwb97f7165/images/large/PG.10239018.JJ3WCXX.PZ.jpg
25589795M,Long Pleated Skirt,109.0,Exceptionally feminine pleated skirt with elastic waist. Pair with a knit cardigan and pumps for a great career look.,https://zzsu-060.dx.commercecloud.salesforce.com/s/RefArch/long-pleated-skirt/25589795M.html?lang=en_US,https://zzsu-060.dx.commercecloud.salesforce.com/on/demandware.static/-/Sites-apparel-m-catalog/default/dwa784e557/images/large/PG.10239110.JJ3WCXX.PZ.jpg
25590848M,Ruffle Trim Jacket,103.99,We've updated our favorite jacket with pleated trim. It's perfect for nine-to-five and beyond.,https://zzsu-060.dx.commercecloud.salesforce.com/s/RefArch/ruffle-trim-jacket/25590848M.html?lang=en_US,https://zzsu-060.dx.commercecloud.salesforce.com/on/demandware.static/-/Sites-apparel-m-catalog/default/dw9a17c3b9/images/large/PG.10224312.JJ169XX.PZ.jpg
25590891M,Button Front Skirt,47.99,We are in love with this button front two pocket slim skirt. It's great for nine-to-five and beyond,https://zzsu-060.dx.commercecloud.salesforce.com/s/RefArch/button-front-skirt/25590891M.html?lang=en_US,https://zzsu-060.dx.commercecloud.salesforce.com/on/demandware.static/-/Sites-apparel-m-catalog/default/dwb913bc72/images/large/PG.10224364.JJ169XX.PZ.jpg
25590900M,Relaxed Fit Cardigan,82.99,Introducing our relaxed fit optical print cardigan! This new piece is perfect for desk-to-dinner. Add a new piece of Commerce Cloud Store jewelry and you are set to go! Introducing our relaxed fit optical print cardigan! This new piece is perfect for desk-to-dinner. Add a new piece of Commerce Cloud Store jewelry and you are set to go!,https://zzsu-060.dx.commercecloud.salesforce.com/s/RefArch/relaxed-fit-cardigan/25590900M.html?lang=en_US,https://zzsu-060.dx.commercecloud.salesforce.com/on/demandware.static/-/Sites-apparel-m-catalog/default/dwe34e2815/images/large/PG.10237914.JJ5YPA4.PZ.jpg
25590921M,Stripe Shell,47.99,This best selling shell is updated with stripes. Pair it with the matching cardigan for a perfect look.,https://zzsu-060.dx.commercecloud.salesforce.com/s/RefArch/stripe-shell/25590921M.html?lang=en_US,https://zzsu-060.dx.commercecloud.salesforce.com/on/demandware.static/-/Sites-apparel-m-catalog/default/dwbbbae6ee/images/large/PG.10237922.JJ5YPA7.PZ.jpg
25590960M,Double Collar Striped Shirt,43.99,We've updated a basic short sleeve shirt with a double collar and cuffs. Pair it with a classic trouser and you are set to go!,https://zzsu-060.dx.commercecloud.salesforce.com/s/RefArch/double-collar-striped-shirt/25590960M.html?lang=en_US,https://zzsu-060.dx.commercecloud.salesforce.com/on/demandware.static/-/Sites-apparel-m-catalog/default/dw6bf6aa69/images/large/PG.10216661.JJK36XX.PZ.jpg
25590981M,Drape Neck Blouse,54.99,Update your wardrobe with this textured white pleat front v-neck blouse for a slimming look.,https://zzsu-060.dx.commercecloud.salesforce.com/s/RefArch/drape-neck-blouse/25590981M.html?lang=en_US,https://zzsu-060.dx.commercecloud.salesforce.com/on/demandware.static/-/Sites-apparel-m-catalog/default/dw3b8a4b28/images/large/PG.10217313.JJI15XX.PZ.jpg
25590995M,Flat Front Slim Pant,54.99,Our flat front slim pant is perfect for every occasion. With its smooth front and back it will flatter you from every angle.,https://zzsu-060.dx.commercecloud.salesforce.com/s/RefArch/flat-front-slim-pant/25590995M.html?lang=en_US,https://zzsu-060.dx.commercecloud.salesforce.com/on/demandware.static/-/Sites-apparel-m-catalog/default/dwe8182771/images/large/PG.10224316.JJ169XX.PZ.jpg
25591026M,Bootleg Pant,68.99,We've updated our favorite bootleg pant with a pinstripe and a contour waistband. The pant has two besom back pockets.,https://zzsu-060.dx.commercecloud.salesforce.com/s/RefArch/bootleg-pant/25591026M.html?lang=en_US,https://zzsu-060.dx.commercecloud.salesforce.com/on/demandware.static/-/Sites-apparel-m-catalog/default/dw89f85ec4/images/large/PG.10224332.JJ0DDXX.PZ.jpg
25591072M,Belted Hooded Jacket,103.99,"A belt, a hood, zippers, pockets and more! This jacket has everything you need to brighten up your wardrobe!",https://zzsu-060.dx.commercecloud.salesforce.com/s/RefArch/belted-hooded-jacket/25591072M.html?lang=en_US,https://zzsu-060.dx.commercecloud.salesforce.com/on/demandware.static/-/Sites-apparel-m-catalog/default/dwdf50bf14/images/large/PG.10224468.JJ5YMXX.PZ.jpg
25591090M,Rose Floral Skirt,50.99,Wow! You will turn heads in this floral slim cut skirt. Add a matching Commerce Cloud Store top and you are ready for desk-to-dinner.,https://zzsu-060.dx.commercecloud.salesforce.com/s/RefArch/rose-floral-skirt/25591090M.html?lang=en_US,https://zzsu-060.dx.commercecloud.salesforce.com/on/demandware.static/-/Sites-apparel-m-catalog/default/dw04197f00/images/large/PG.10232320.JJ9DFXX.PZ.jpg
25591111M,Leather Top Front Studded Jacket,145.99,This is truly a wow piece that will update any basic bottom. You'll look fabulous with this studded jacket and a great Commerce Cloud Store bottom. This is truly a wow piece that will update any basic bottom. You'll look fabulous with this studded jacket and a great Commerce Cloud Store bottom.,https://zzsu-060.dx.commercecloud.salesforce.com/s/RefArch/leather-top-front-studded-jacket/25591111M.html?lang=en_US,https://zzsu-060.dx.commercecloud.salesforce.com/on/demandware.static/-/Sites-apparel-m-catalog/default/dw375c156d/images/large/PG.10232564.JJ169XX.PZ.jpg
25591116M,Mini Print Jacket,110.99,This mini-print jacket with seaming detail and two front pockets is a wardrobe completer.,https://zzsu-060.dx.commercecloud.salesforce.com/s/RefArch/mini-print-jacket/25591116M.html?lang=en_US,https://zzsu-060.dx.commercecloud.salesforce.com/on/demandware.static/-/Sites-apparel-m-catalog/default/dwa431275f/images/large/PG.10232592.JJ0DDXX.PZ.jpg
25591125M,Striped Shirt,40.99,This striped shirt is fabulously updated with a contrasting print on the collar and cuffs. Wear the collar up and the cuffs rolled back for a great look.,https://zzsu-060.dx.commercecloud.salesforce.com/s/RefArch/striped-shirt/25591125M.html?lang=en_US,https://zzsu-060.dx.commercecloud.salesforce.com/on/demandware.static/-/Sites-apparel-m-catalog/default/dwf101c087/images/large/PG.10232676.JJK36XX.PZ.jpg
25591139M,Paisley Shirt,43.99,Our paisley shirts are always a best seller. This paisley shirt is both fashionable and sophisticated.,https://zzsu-060.dx.commercecloud.salesforce.com/s/RefArch/paisley-shirt/25591139M.html?lang=en_US,https://zzsu-060.dx.commercecloud.salesforce.com/on/demandware.static/-/Sites-apparel-m-catalog/default/dw83dbf8d7/images/large/PG.10232700.JJ0DDXX.PZ.jpg
25591144M,Dot Tie Front Blouse,47.99,Take a dot print and update it with a tie waist. That gives you a perfect blouse for day or evening in a head turning pattern,https://zzsu-060.dx.commercecloud.salesforce.com/s/RefArch/dot-tie-front-blouse/25591144M.html?lang=en_US,https://zzsu-060.dx.commercecloud.salesforce.com/on/demandware.static/-/Sites-apparel-m-catalog/default/dwa8c4389a/images/large/PG.10232708.JJ0DDXX.PZ.jpg
25591149M,Floral Print Blouse,54.99,Take a floral pattern and update it in black and white. That gives you a perfect top for day or night.,https://zzsu-060.dx.commercecloud.salesforce.com/s/RefArch/floral-print-blouse/25591149M.html?lang=en_US,https://zzsu-060.dx.commercecloud.salesforce.com/on/demandware.static/-/Sites-apparel-m-catalog/default/dw74db7ee9/images/large/PG.10232720.JJ0DDXX.PZ.jpg
25591195M,Graphic Print Sweater,61.99,Update your wardrobe with this graphic patterned sweater. Graphic patterns are a sure way to update your wardrobe. Add a new piece of Commerce Cloud Store jewelry and you will look fabulous.,https://zzsu-060.dx.commercecloud.salesforce.com/s/RefArch/graphic-print-sweater/25591195M.html?lang=en_US,https://zzsu-060.dx.commercecloud.salesforce.com/on/demandware.static/-/Sites-apparel-m-catalog/default/dw36b73c22/images/large/PG.10237878.JJ0DDXX.PZ.jpg
25591222M,3/4 Sleeve Cardigan,103.99,This best selling cardigan is updated in stripes.. Pair it with the matching stripe shell for a perfect look.,https://zzsu-060.dx.commercecloud.salesforce.com/s/RefArch/3/4-sleeve-cardigan/25591222M.html?lang=en_US,https://zzsu-060.dx.commercecloud.salesforce.com/on/demandware.static/-/Sites-apparel-m-catalog/default/dw95c03a5e/images/large/PG.10237954.JJ0DDXX.PZ.jpg
25591227M,Floral Ruffle Top,54.99,Pair our favorite floral ruffle shirt with our new wide leg pants. You can dress this up or down for a perfect look.,https://zzsu-060.dx.commercecloud.salesforce.com/s/RefArch/floral-ruffle-top/25591227M.html?lang=en_US,https://zzsu-060.dx.commercecloud.salesforce.com/on/demandware.static/-/Sites-apparel-m-catalog/default/dw1e60fecf/images/large/PG.10240939.JJ9DFXX.PZ.jpg
25591241M,Classic Yoke Pant,80.99,"This classic pant, with a contour waist and 2 back besom pockets is a must for every wardrobe. It's perfect from day-to-dinner This classic pant, with a contour waist and 2 back besom pockets is a must for every wardrobe. It's perfect from day-to-dinner",https://zzsu-060.dx.commercecloud.salesforce.com/s/RefArch/classic-yoke-pant/25591241M.html?lang=en_US,https://zzsu-060.dx.commercecloud.salesforce.com/on/demandware.static/-/Sites-apparel-m-catalog/default/dwafd4123f/images/large/PG.10220645.JJ2DGXX.PZ.jpg
25591295M,Slim Pant,73.99,Finding the perfect pant has never been easier. This straight leg pant with coin pocket and light stretch material is great for office wear. Finding the perfect pant has never been easier. This straight leg pant with coin pocket and light stretch material is great for office wear.,https://zzsu-060.dx.commercecloud.salesforce.com/s/RefArch/slim-pant/25591295M.html?lang=en_US,https://zzsu-060.dx.commercecloud.salesforce.com/on/demandware.static/-/Sites-apparel-m-catalog/default/dw4d472399/images/large/PG.10221015.JJIX2XX.PZ.jpg
25591331M,One Button Flat Front Jacket,155.99,Time to update your assortment with this great one button suit jacket. You will love its easy fit and classic look. Time to update your assortment with this great one button suit jacket. You will love its easy fit and classic look.,https://zzsu-060.dx.commercecloud.salesforce.com/s/RefArch/one-button-flat-front-jacket/25591331M.html?lang=en_US,https://zzsu-060.dx.commercecloud.salesforce.com/on/demandware.static/-/Sites-apparel-m-catalog/default/dw690c1f79/images/large/PG.10221466.JJY94A0.PZ.jpg
25591339M,Textured 1 Button Jacket,155.99,We took our best selling jacket and updated it with a new color for the season. Start showing off! We took our best selling jacket and updated it with a new color for the season. Start showing off!,https://zzsu-060.dx.commercecloud.salesforce.com/s/RefArch/textured-1-button-jacket/25591339M.html?lang=en_US,https://zzsu-060.dx.commercecloud.salesforce.com/on/demandware.static/-/Sites-apparel-m-catalog/default/dw3a11a8af/images/large/PG.10221562.JJ7ZVXX.PZ.jpg
